{
  "slug": "asuncion-gomez-perez-elegida-para-ocupar-la-silla-q-de-la-rae",
  "lang": "es",
  "path": "/es/asuncion-gomez-perez-elegida-para-ocupar-la-silla-q-de-la-rae/",
  "title": "Asunción Gómez-Pérez, elegida para ocupar la silla «q» de la RAE.",
  "wpId": 297,
  "date": "2022-04-08T10:54:21+00:00",
  "modified": "2023-11-23T18:16:32+00:00",
  "author": "admin",
  "categories": [
    "noticias-es"
  ],
  "tags": [],
  "translations": {},
  "seo": {
    "title": "Asunción Gómez-Pérez, elegida para ocupar la silla «q» de la RAE. - Máster Universitario en Inteligencia Artificial",
    "ogDescription": "El Pleno de la Real Academia Española (RAE), en su sesión del jueves 7 de abril, ha elegido a Asunción […]",
    "image": {
      "src": "/wp-content/uploads/sites/6/2022/04/Asun.jpg",
      "width": 220,
      "height": 147,
      "type": "image/jpeg"
    },
    "schemaImage": {
      "src": "/wp-content/uploads/sites/6/2022/04/Asun.jpg",
      "width": 220,
      "height": 147,
      "caption": "Asun"
    },
    "twitter": {
      "twitter:label1": "Escrito por",
      "twitter:data1": "admin",
      "twitter:label2": "Tiempo de lectura",
      "twitter:data2": "1 minuto"
    }
  },
  "blocks": [
    {
      "type": "html",
      "html": "<p>El Pleno de la Real Academia Española (RAE), en su sesión del jueves 7 de abril, ha elegido a Asunción Gómez Pérez, catedrática de nuestro Departamento y experta en Inteligencia Artificial y lenguaje, para ocupar la silla «q», vacante desde el fallecimiento de Gregorio Salvador.<br>\nSu candidatura fue presentada por los académicos Luis Mateo Díez, Pedro R. García Barreno y Salvador Gutiérrez Ordóñez.<br>\nLa profesora Asunción Gómez ha expresado su intención de contribuir al proyecto de Lengua Española e Inteligencia Artificial (LEIA) centrando su aportación en “las temáticas de inteligencia artificial y lenguaje», para mejorar así la utilización del español en los ámbitos en que se desarrolla la inteligencia artificial.</p>\n<p>Mas detalles sobre esta noticia en el siguiente <a href=\"https://www.rae.es/noticia/la-experta-en-inteligencia-artificial-y-lenguaje-asuncion-gomez-perez-elegida-para-ocupar\" target=\"_blank\" rel=\"noopener\">enlace</a>.&nbsp;</p>"
    }
  ],
  "featuredImage": {
    "src": "/wp-content/uploads/sites/6/2022/04/Asun.jpg",
    "width": 220,
    "height": 147,
    "alt": "Asun"
  },
  "wordCount": 152,
  "excerpt": "<p>El Pleno de la Real Academia Española (RAE), en su sesión del jueves 7 de abril, ha elegido a Asunción</p>",
  "listImage": {
    "src": "/wp-content/uploads/sites/6/2022/04/Asun.jpg",
    "width": 220,
    "height": 147,
    "alt": "Asun"
  }
}
