{
  "slug": "tercer-mejor-master-de-espana-en-informatica-especializada-2018",
  "lang": "es",
  "path": "/es/tercer-mejor-master-de-espana-en-informatica-especializada-2018/",
  "title": "Tercer mejor máster de España en Informática Especializada, 2018",
  "wpId": 53,
  "date": "2018-06-25T14:37:38+00:00",
  "modified": "2023-11-23T18:45:16+00:00",
  "author": "jcano",
  "categories": [
    "noticias-es"
  ],
  "tags": [],
  "translations": {},
  "seo": {
    "title": "Tercer mejor máster de España en Informática Especializada, 2018 - Máster Universitario en Inteligencia Artificial",
    "ogDescription": "EL MUIA aparece en tercera posición en el área de Informática Especializada en el ranking “250 Másteres y Guía Completa MBA” […]",
    "image": {
      "src": "/wp-content/uploads/sites/6/2017/06/RANKING-EL-MUNDO.png",
      "width": 220,
      "height": 153,
      "type": "image/png"
    },
    "schemaImage": {
      "src": "/wp-content/uploads/sites/6/2017/06/RANKING-EL-MUNDO.png",
      "width": 220,
      "height": 153,
      "caption": "RANKING EL MUNDO"
    },
    "twitter": {
      "twitter:label1": "Escrito por",
      "twitter:data1": "jcano",
      "twitter:label2": "Tiempo de lectura",
      "twitter:data2": "1 minuto"
    }
  },
  "blocks": [
    {
      "type": "html",
      "html": "<p class=\"rtejustify\">EL MUIA aparece en tercera&nbsp;posición en el área de Informática Especializada en el <a href=\"http://www.elmundo.es/especiales/mejores-masters/especializados-informatica.html\" target=\"_top\" rel=\"noopener\">ranking “250 Másteres y Guía Completa MBA”</a> que ha publicado el periódico el Mundo un su edición 2018. El MUIA se encuentra por noveno año consecutivo entre los tres mejores másteres de Informática Especializada en España, habiendo sido en dos ediciones distinguido como mejor máster de España en esta sección</p>\n<p><span id=\"more-53\"></span></p>\n<p class=\"rtejustify\">EL MUIA aparece en tercera&nbsp;posición en el área de Informática Especializada en el <a href=\"http://www.elmundo.es/especiales/mejores-masters/especializados-informatica.html\" target=\"_top\" rel=\"noopener\">ranking “250 Másteres y Guía Completa MBA”</a> que ha publicado el periódico el Mundo un su edición 2018. El MUIA se encuentra por noveno año consecutivo entre los tres mejores másteres de Informática Especializada en España, habiendo sido en dos ediciones distinguido como mejor máster de España en esta sección.</p>"
    }
  ],
  "featuredImage": {
    "src": "/wp-content/uploads/sites/6/2017/06/RANKING-EL-MUNDO.png",
    "width": 220,
    "height": 153,
    "alt": "RANKING EL MUNDO"
  },
  "wordCount": 163,
  "excerpt": "<p>EL MUIA aparece en tercera&nbsp;posición en el área de Informática Especializada en el ranking “250 Másteres y Guía Completa MBA”</p>",
  "listImage": {
    "src": "/wp-content/uploads/sites/6/2017/06/RANKING-EL-MUNDO.png",
    "width": 220,
    "height": 153,
    "alt": "RANKING EL MUNDO"
  }
}
