{
  "slug": "concha-bielza-nombrada-miembro-del-consejo-cientifico-asesor-del-norwai",
  "lang": "es",
  "path": "/es/concha-bielza-nombrada-miembro-del-consejo-cientifico-asesor-del-norwai/",
  "title": "Concha Bielza nombrada Miembro del Consejo Científico Asesor del NorwAI",
  "wpId": 279,
  "date": "2021-05-31T07:56:45+00:00",
  "modified": "2023-11-23T18:20:14+00:00",
  "author": "admin",
  "categories": [
    "noticias-es"
  ],
  "tags": [],
  "translations": {},
  "seo": {
    "title": "Concha Bielza nombrada Miembro del Consejo Científico Asesor del NorwAI - Máster Universitario en Inteligencia Artificial",
    "ogDescription": "Conchas Bielza ha sido nombrada Miembro del Consejo Científico Asesor del Norwegian Research Center for AI Innovation (NorwAI) pertenenciente a la […]",
    "image": {
      "src": "/wp-content/uploads/sites/6/2021/05/618ED073-BB6A-4E1F-B788-349F57163C37.jpeg",
      "width": 220,
      "height": 124,
      "type": "image/jpeg"
    },
    "schemaImage": {
      "src": "/wp-content/uploads/sites/6/2021/05/618ED073-BB6A-4E1F-B788-349F57163C37.jpeg",
      "width": 220,
      "height": 124,
      "caption": "618ED073-BB6A-4E1F-B788-349F57163C37"
    },
    "twitter": {
      "twitter:label1": "Escrito por",
      "twitter:data1": "admin"
    }
  },
  "blocks": [
    {
      "type": "html",
      "html": "<p>Conchas Bielza ha sido nombrada Miembro del Consejo Científico Asesor del Norwegian Research Center for AI Innovation (NorwAI)&nbsp;pertenenciente a la Norwegian University of Science and Technology (Noruega). El centro coordina actividades de investigación, desarrollo e innovación de varias universidades, centros de investigación y prestigiosas compañías, con el objetivo de promover y potenciar la economía de los países escandinavos.</p>\n<p>Más información en:&nbsp;https://www.ntnu.edu/norwai</p>"
    }
  ],
  "featuredImage": {
    "src": "/wp-content/uploads/sites/6/2021/05/618ED073-BB6A-4E1F-B788-349F57163C37.jpeg",
    "width": 220,
    "height": 124,
    "alt": "618ED073-BB6A-4E1F-B788-349F57163C37"
  },
  "wordCount": 89,
  "excerpt": "<p>Conchas Bielza ha sido nombrada Miembro del Consejo Científico Asesor del Norwegian Research Center for AI Innovation (NorwAI)&nbsp;pertenenciente a la</p>",
  "listImage": {
    "src": "/wp-content/uploads/sites/6/2021/05/618ED073-BB6A-4E1F-B788-349F57163C37.jpeg",
    "width": 220,
    "height": 124,
    "alt": "618ED073-BB6A-4E1F-B788-349F57163C37"
  }
}
