{
  "slug": "oscar-corcho-garcia-catedratico-del-dia-y-profesor-del-muia-obtiene-el-premio-juan-lopez-de-penalver-de-la-real-academia-de-ingenieria",
  "lang": "es",
  "path": "/es/oscar-corcho-garcia-catedratico-del-dia-y-profesor-del-muia-obtiene-el-premio-juan-lopez-de-penalver-de-la-real-academia-de-ingenieria/",
  "title": "Óscar Corcho García, catedrático del DIA y profesor del MUIA, obtiene el Premio Juan López de Peñalver de la Real Academia de Ingeniería",
  "wpId": 37,
  "date": "2017-05-30T09:10:13+00:00",
  "modified": "2023-11-23T18:52:30+00:00",
  "author": "jcano",
  "categories": [
    "actualidad-es",
    "noticias-es",
    "noticias-destacadas"
  ],
  "tags": [],
  "translations": {
    "en": "/en/spanish-royal-academy-of-engineering-awards-the-juan-lopez-de-penalver-prize-to-oscar-corcho-garcia-full-professor-at-the-department-of-artificial-intelligence/",
    "es": "/es/oscar-corcho-garcia-catedratico-del-dia-y-profesor-del-muia-obtiene-el-premio-juan-lopez-de-penalver-de-la-real-academia-de-ingenieria/"
  },
  "seo": {
    "title": "Óscar Corcho García, catedrático del DIA y profesor del MUIA, obtiene el Premio Juan López de Peñalver de la Real Academia de Ingeniería - Máster Universitario en Inteligencia Artificial",
    "ogDescription": "La Real Academia de Ingeniería ha concedido el Premio Juan López de Peñalver a Óscar Corcho, catedrático de la ETSI […]",
    "image": {
      "src": "/wp-content/uploads/sites/6/2017/05/oscar.png",
      "width": 136,
      "height": 220,
      "type": "image/png"
    },
    "schemaImage": {
      "src": "/wp-content/uploads/sites/6/2017/05/oscar.png",
      "width": 136,
      "height": 220,
      "caption": "oscar"
    },
    "twitter": {
      "twitter:label1": "Escrito por",
      "twitter:data1": "jcano",
      "twitter:label2": "Tiempo de lectura",
      "twitter:data2": "2 minutos"
    }
  },
  "blocks": [
    {
      "type": "html",
      "html": "<p class=\"rtejustify\">La <a href=\"http://www.raing.es/\">Real Academia de Ingeniería</a> ha concedido el Premio Juan López de Peñalver a Óscar Corcho, catedrático de la <a href=\"http://www.etsiinf.upm.es/\">ETSI Informáticos</a> y codirector del <a href=\"http://www.upm.es/observatorio/vi/index.jsp?pageac=fichaGrupo.jsp&amp;id_articulo=278&amp;id_tipo_articulo=6&amp;idGrupo=323\">Grupo de Ingeniería Ontológica</a>. El premio reconoce sus contribuciones en el estudio de la web semántica y la web de datos enlazados, la ingeniería ontológica y la aplicación de tecnologías semánticas en distintos dominios, como, por ejemplo, la e-ciencia y la ciencia abierta.</p>\n<p><span id=\"more-37\"></span></p>\n<p class=\"rtejustify\">La <a href=\"http://www.raing.es/\">Real Academia de Ingeniería</a> (RAI) ha reconocido a dos miembros de la <a href=\"http://www.upm.es/\">Universidad Politécnica de Madrid</a> (UPM) en la edición de 2016 de sus galardones destinados a investigadores y profesionales jóvenes que hayan realizado labores de innovación, contribuciones notorias o una obra singular en cualquiera de los campos de la ingeniería. El Premio Juan López de Peñalver ha recaído en Óscar Corcho, catedrático de la <a href=\"http://www.etsiinf.upm.es/\">Escuela Técnica Superior de Ingenieros Informáticos</a> y codirector del <a href=\"http://www.upm.es/observatorio/vi/index.jsp?pageac=fichaGrupo.jsp&amp;id_articulo=278&amp;id_tipo_articulo=6&amp;idGrupo=323\">Grupo de Ingeniería Ontológica</a>. José María Ulloa, investigador del <a href=\"http://www.isom.upm.es/\">Instituto de Sistemas Optolectrónicos y Microtecnología</a>, ha obtenido una medalla como finalista del Premio Juan López de Peñalver. Mañana se celebrará la entrega de las distinciones.</p>\n<p class=\"rtejustify\">Óscar Corcho es licenciado en Informática (2000), máster en Ingeniería del Software (2001) y doctor en Ciencias de la Computación e Inteligencia Artificial (2004) por la UPM. El premio de la Real Academia de Ingeniería reconoce sus contribuciones en el estudio de la web semántica y la web de datos enlazados, la ingeniería ontológica y la aplicación de tecnologías semánticas en distintos dominios, como, por ejemplo, la e-ciencia y la ciencia abierta. Actualmente, coordina dos acciones europeas Marie Curie (<a href=\"http://www.semdata-project.eu/\">SemData</a> y KOPAR) y un proyecto del programa europeo Horizonte 2020 (STARS4ALL).</p>"
    }
  ],
  "featuredImage": {
    "src": "/wp-content/uploads/sites/6/2017/05/oscar.png",
    "width": 136,
    "height": 220,
    "alt": "oscar",
    "srcset": "/wp-content/uploads/sites/6/2017/05/oscar.png 136w, /wp-content/uploads/sites/6/2017/05/oscar-50x81.png 50w",
    "sizes": "(max-width: 136px) 100vw, 136px"
  },
  "wordCount": 336,
  "parentPage": "/es/admision_y_matricula/",
  "excerpt": "<p>La Real Academia de Ingeniería ha concedido el Premio Juan López de Peñalver a Óscar Corcho, catedrático de la ETSI […]</p>",
  "listImage": {
    "src": "/wp-content/uploads/sites/6/2017/05/oscar.png",
    "width": 136,
    "height": 220,
    "alt": "oscar",
    "srcset": "/wp-content/uploads/sites/6/2017/05/oscar.png 136w, /wp-content/uploads/sites/6/2017/05/oscar-50x81.png 50w",
    "sizes": "(max-width: 136px) 100vw, 136px"
  }
}
