{
  "slug": "segunda-posicion-del-muia-en-el-ranking-de-el-mundo",
  "lang": "es",
  "path": "/es/segunda-posicion-del-muia-en-el-ranking-de-el-mundo/",
  "title": "Segunda posición del MUIA en el ranking de El Mundo",
  "wpId": 284,
  "date": "2021-07-17T05:07:13+00:00",
  "modified": "2023-11-23T18:58:33+00:00",
  "author": "ajimenez",
  "categories": [
    "noticias-es",
    "noticias-destacadas"
  ],
  "tags": [],
  "translations": {},
  "seo": {
    "title": "Segunda posición del MUIA en el ranking de El Mundo - Máster Universitario en Inteligencia Artificial",
    "ogDescription": "La nueva edición 2021/2022 del ranking de El Mundo posiciona al Máster U. en Inteligencia Artificial en segunda posición en […]",
    "image": {
      "src": "/wp-content/uploads/sites/6/2021/07/4394-0-RankingMa__769_steres_2021.jpg",
      "width": 220,
      "height": 212,
      "type": "image/jpeg"
    },
    "schemaImage": {
      "src": "/wp-content/uploads/sites/6/2021/07/4394-0-RankingMa__769_steres_2021.jpg",
      "width": 220,
      "height": 212,
      "caption": "4394-0-RankingMa__769_steres_2021"
    },
    "twitter": {
      "twitter:label1": "Escrito por",
      "twitter:data1": "ajimenez",
      "twitter:label2": "Tiempo de lectura",
      "twitter:data2": "1 minuto"
    }
  },
  "blocks": [
    {
      "type": "html",
      "html": "<p class=\"rtejustify\">La nueva edición 2021/2022 del ranking de El Mundo posiciona al Máster U. en Inteligencia Artificial en segunda posición en la sección de Informática especializada.</p>\n<p><span id=\"more-284\"></span></p>\n<p class=\"rtejustify\">La nueva edición 2021/2022 del ranking de El Mundo posiciona al Máster U. en Inteligencia Artificial en segunda posición en la sección de Informática especializada.</p>\n<p class=\"rtejustify\">En los últimos 11 años el MUIA siempre ha aparecido entre los 3 mejores másteres en Informática especializada, habiendo ocupado la primera posición en dos ocasiones.</p>\n<p class=\"rtejustify\">Para elaborar la clasificación, han participado más de 800 expertos, profesores, estudiantes, antiguos alumnos y empresas. El diario analiza diferentes parámetros: nivel de demanda del máster, los recursos humanos con los que cuenta, la innovación de la calidad docente y la metodología o su plan de estudios son algunos de los criterios que se tienen en cuenta. También evalúa los resultados obtenidos por los alumnos, el número de empresas que contratan a los estudiantes una vez que culminan su formación o los medios materiales, como laboratorios y espacios especializados, y el empleo de las nuevas tecnologías.</p>"
    }
  ],
  "featuredImage": {
    "src": "/wp-content/uploads/sites/6/2021/07/4394-0-RankingMa__769_steres_2021.jpg",
    "width": 220,
    "height": 212,
    "alt": "4394-0-RankingMa__769_steres_2021"
  },
  "wordCount": 203,
  "excerpt": "<p>La nueva edición 2021/2022 del ranking de El Mundo posiciona al Máster U. en Inteligencia Artificial en segunda posición en</p>",
  "listImage": {
    "src": "/wp-content/uploads/sites/6/2021/07/4394-0-RankingMa__769_steres_2021.jpg",
    "width": 220,
    "height": 212,
    "alt": "4394-0-RankingMa__769_steres_2021"
  }
}
