{
  "slug": "proyecto-de-reconocimiento-e-interaccion-visual-del-centro-ai-nnovation-space-en-el-hormiguero-antena-3",
  "lang": "es",
  "path": "/es/proyecto-de-reconocimiento-e-interaccion-visual-del-centro-ai-nnovation-space-en-el-hormiguero-antena-3/",
  "title": "Proyecto de Reconocimiento e Interacción Visual del Centro AI.nnovation Space en El Hormiguero (Antena 3)",
  "wpId": 165,
  "date": "2019-02-27T11:36:11+00:00",
  "modified": "2023-11-23T18:39:23+00:00",
  "author": "ajimenez",
  "categories": [
    "noticias-es"
  ],
  "tags": [],
  "translations": {},
  "seo": {
    "title": "Proyecto de Reconocimiento e Interacción Visual del Centro AI.nnovation Space en El Hormiguero (Antena 3) - Máster Universitario en Inteligencia Artificial",
    "ogDescription": "El proyecto de Reconocimiento e Interacción Visual desarrollado en el Centro AI.nnovation Space por ex alumnos del Máster U. en Inteligencia Artificial se […]",
    "image": {
      "src": "/wp-content/uploads/sites/6/2019/02/Captura-de-pantalla-2019-02-27-a-las-12.31.16_0.png",
      "width": 220,
      "height": 166,
      "type": "image/png"
    },
    "schemaImage": {
      "src": "/wp-content/uploads/sites/6/2019/02/Captura-de-pantalla-2019-02-27-a-las-12.31.16_0.png",
      "width": 220,
      "height": 166,
      "caption": "Captura de pantalla 2019-02-27 a las 12"
    },
    "twitter": {
      "twitter:label1": "Escrito por",
      "twitter:data1": "ajimenez",
      "twitter:label2": "Tiempo de lectura",
      "twitter:data2": "1 minuto"
    }
  },
  "blocks": [
    {
      "type": "html",
      "html": "<p class=\"rtejustify\">El proyecto de Reconocimiento e Interacción Visual desarrollado en el&nbsp;<a href=\"https://www.ainnovation.upm.es\" target=\"_blank\" rel=\"noopener\">Centro AI.nnovation Space</a>&nbsp;por ex alumnos del Máster U. en Inteligencia Artificial&nbsp;se ha presentado en el el programa El Hormiguero (Antena 3)</p>\n<p><span id=\"more-165\"></span></p>\n<p class=\"rtejustify\">El proyecto de Reconocimiento e Interacción Visual desarrollado en el&nbsp;<a href=\"https://www.ainnovation.upm.es\" target=\"_blank\" rel=\"noopener\">Centro tecnológico mixto UPM – Accenture «AI.nnovation Space»</a>&nbsp;por ex alumnos del MUIA&nbsp;se ha presentado en el el programa El Hormiguero (Antena 3)</p>\n<p class=\"rtejustify\">Los autores del proyecto son:&nbsp;Andrés Prados, Serge Chavez y Luis Baumela Molina (profesor del MUIA)</p>\n<p class=\"rtejustify\">El vídeo de la presentación está disponible en:</p>\n<p class=\"rtejustify\"><a href=\"https://www.antena3.com/programas/el-hormiguero/secciones/ciencia-marron/marron-sorprende-avance-tecnologico-podria-cambiar-mundo_201902265c75b3400cf2acca9c2e11ea.html\" target=\"_blank\" rel=\"noopener\">https://www.antena3.com/programas/el-hormiguero/secciones/ciencia-marron/marron-sorprende-avance-tecnologico-podria-cambiar-mundo_201902265c75b3400cf2acca9c2e11ea.html</a></p>"
    }
  ],
  "featuredImage": {
    "src": "/wp-content/uploads/sites/6/2019/02/Captura-de-pantalla-2019-02-27-a-las-12.31.16_0.png",
    "width": 220,
    "height": 166,
    "alt": "Captura de pantalla 2019-02-27 a las 12"
  },
  "wordCount": 138,
  "excerpt": "<p>El proyecto de Reconocimiento e Interacción Visual desarrollado en el&nbsp;Centro AI.nnovation Space&nbsp;por ex alumnos del Máster U. en Inteligencia Artificial&nbsp;se</p>",
  "listImage": {
    "src": "/wp-content/uploads/sites/6/2019/02/Captura-de-pantalla-2019-02-27-a-las-12.31.16_0.png",
    "width": 220,
    "height": 166,
    "alt": "Captura de pantalla 2019-02-27 a las 12"
  }
}
