{
  "slug": "pedro-larranaga-mugica-premio-de-incorporacion-de-excelencia-investigadora-de-la-upm-2019",
  "lang": "es",
  "path": "/es/pedro-larranaga-mugica-premio-de-incorporacion-de-excelencia-investigadora-de-la-upm-2019/",
  "title": "Pedro Larrañaga Múgica, Premio de Incorporación de Excelencia Investigadora de la UPM 2019",
  "wpId": 196,
  "date": "2019-12-19T08:28:51+00:00",
  "modified": "2023-11-23T18:34:19+00:00",
  "author": "ajimenez",
  "categories": [
    "noticias-es"
  ],
  "tags": [],
  "translations": {},
  "seo": {
    "title": "Pedro Larrañaga Múgica, Premio de Incorporación de Excelencia Investigadora de la UPM 2019 - Máster Universitario en Inteligencia Artificial",
    "ogDescription": "Pedro Larrañaga Múgica, profesor del Máster U. en Inteligencia Artificial, ha recibido el Premio de Incorporación de Excelencia Investigadora de […]",
    "image": {
      "src": "/wp-content/uploads/sites/6/2019/12/Pedro_0_0_0.jpg",
      "width": 176,
      "height": 220,
      "type": "image/jpeg"
    },
    "schemaImage": {
      "src": "/wp-content/uploads/sites/6/2019/12/Pedro_0_0_0.jpg",
      "width": 176,
      "height": 220,
      "caption": "Pedro_0_0"
    },
    "twitter": {
      "twitter:label1": "Escrito por",
      "twitter:data1": "ajimenez",
      "twitter:label2": "Tiempo de lectura",
      "twitter:data2": "1 minuto"
    }
  },
  "blocks": [
    {
      "type": "html",
      "html": "<p class=\"rtejustify\">Pedro Larrañaga Múgica, profesor del Máster U. en Inteligencia Artificial, ha recibido el Premio de Incorporación de Excelencia Investigadora de la Universidad Politécnica de Madrid&nbsp;2019.</p>\n<p><span id=\"more-196\"></span></p>\n<p class=\"rtejustify\">Pedro&nbsp;Larrañaga Múgica, Investigador Principal del <a href=\"http://cig.fi.upm.es\" target=\"_blank\" rel=\"noopener\">Computational Intelligence Group</a> y&nbsp;profesor del Máster U. en Inteligencia Artificial, ha recibido el Premio de Incorporación de Excelencia Investigadora de la Universidad Politécnica de Madrid&nbsp;2019.</p>\n<p class=\"rtejustify\">El premio reconoce al profesor en activo a tiempo completo de la UPM que más haya destacado en su vida profesional por su labor investigadora en cualquiera de las áreas de conocimiento de la Universidad. Este premio reconoce el talento de profesores que se incorporan a la UPM habiendo estado previamente vinculados a otra institución por un periodo de al menos 5 años como doctor.&nbsp;</p>"
    }
  ],
  "featuredImage": {
    "src": "/wp-content/uploads/sites/6/2019/12/Pedro_0_0_0.jpg",
    "width": 176,
    "height": 220,
    "alt": "Pedro_0_0"
  },
  "wordCount": 154,
  "excerpt": "<p>Pedro Larrañaga Múgica, profesor del Máster U. en Inteligencia Artificial, ha recibido el Premio de Incorporación de Excelencia Investigadora de</p>",
  "listImage": {
    "src": "/wp-content/uploads/sites/6/2019/12/Pedro_0_0_0.jpg",
    "width": 176,
    "height": 220,
    "alt": "Pedro_0_0"
  }
}
