{
  "slug": "master-of-science-in-artificial-intelligence-is-granted-euro-inf-quality-label",
  "lang": "en",
  "path": "/en/master-of-science-in-artificial-intelligence-is-granted-euro-inf-quality-label/",
  "title": "Master of Science in Artificial Intelligence is granted EURO-INF Quality Label",
  "wpId": 48,
  "date": "2021-05-30T09:10:10+00:00",
  "modified": "2023-11-24T00:34:11+00:00",
  "author": "jcano",
  "categories": [
    "currenta-affairs",
    "news",
    "top-stories"
  ],
  "tags": [],
  "translations": {
    "en": "/en/master-of-science-in-artificial-intelligence-is-granted-euro-inf-quality-label/",
    "es": "/es/el-master-u-en-inteligencia-artificial-obtiene-el-sello-euro-inf/"
  },
  "seo": {
    "title": "Master of Science in Artificial Intelligence is granted EURO-INF Quality Label - Máster Universitario en Inteligencia Artificial",
    "ogDescription": "The Master of Science in Artificial Intelligence received the EURO-INF quality label on 26 June 2016. The EURO-INF quality label […]",
    "image": {
      "src": "/wp-content/uploads/sites/6/2017/05/Sello-Euroinf.png",
      "width": 220,
      "height": 192,
      "type": "image/png"
    },
    "schemaImage": {
      "src": "/wp-content/uploads/sites/6/2017/05/Sello-Euroinf.png",
      "width": 220,
      "height": 192,
      "caption": "Sello Euroinf"
    },
    "twitter": {
      "twitter:label1": "Written by",
      "twitter:data1": "jcano",
      "twitter:label2": "Est. reading time",
      "twitter:data2": "1 minute"
    }
  },
  "blocks": [
    {
      "type": "html",
      "html": "<p class=\"rtejustify\">The Master of Science in Artificial Intelligence received the EURO-INF quality label on 26 June 2016.</p>\n<p class=\"rtejustify\">The EURO-INF quality label is a certificate awarded to a university in respect of a bachelor’s or master’s informatics degree programme assessed according to a series of set standards in accordance with the principles of quality, relevance, transparency, recognition and mobility as provided for in the European Higher Education Area.</p>\n<p><span id=\"more-48\"></span></p>\n<p class=\"rtejustify\">The Master of Science in Artificial Intelligence received the EURO-INF quality label on 26 June 2016.</p>\n<p class=\"rtejustify\">The EURO-INF quality label is a certificate awarded to a university in respect of a bachelor’s or master’s informatics degree programme assessed according to a series of set standards in accordance with the principles of quality, relevance, transparency, recognition and mobility as provided for in the European Higher Education Area.</p>\n<p class=\"rtejustify\">The <a href=\"http://www.eqanie.eu/\">European Quality Assurance Network for Informatics Education (EQANIE)</a> has been the European association regulating the award the EURO-INF quality label since 2009. This quality label is recognized internationally and promotes academic and professional mobility, as it identifies high quality informatics programmes inside and outside Europe.</p>\n<p class=\"rtejustify\">As of autumn 2013, ACREDITA PLUS began to offer the option of applying for the assessment of official bachelor’s and master’s informatics degree programmes for the EURO-INF quality label within the informatics field at the same time as they are assessed for renewal of degree programme accreditation.</p>"
    }
  ],
  "featuredImage": {
    "src": "/wp-content/uploads/sites/6/2017/05/Sello-Euroinf.png",
    "width": 220,
    "height": 192,
    "alt": "Sello Euroinf"
  },
  "wordCount": 236,
  "excerpt": "<p>The Master of Science in Artificial Intelligence received the EURO-INF quality label on 26 June 2016. The EURO-INF quality label</p>",
  "listImage": {
    "src": "/wp-content/uploads/sites/6/2017/05/Sello-Euroinf.png",
    "width": 220,
    "height": 192,
    "alt": "Sello Euroinf"
  }
}
