{
  "slug": "asuncion-gomez-perez-nombrada-fellow-of-the-european-academy-of-sciences",
  "lang": "es",
  "path": "/es/asuncion-gomez-perez-nombrada-fellow-of-the-european-academy-of-sciences/",
  "title": "Asunción Gómez Pérez nombrada Fellow of the European Academy of Sciences",
  "wpId": 125,
  "date": "2018-06-28T05:26:35+00:00",
  "modified": "2023-11-23T18:43:32+00:00",
  "author": "ajimenez",
  "categories": [
    "noticias-es"
  ],
  "tags": [],
  "translations": {},
  "seo": {
    "title": "Asunción Gómez Pérez nombrada Fellow of the European Academy of Sciences - Máster Universitario en Inteligencia Artificial",
    "ogDescription": "La Catedrática de Universidad y profesoresa del MUIA, Asunción Gómez Pérez ha sido recientemente nombrada Fellow of the European Academy of […]",
    "image": {
      "src": "/wp-content/uploads/sites/6/2018/06/asun_0_0.png",
      "width": 220,
      "height": 151,
      "type": "image/png"
    },
    "schemaImage": {
      "src": "/wp-content/uploads/sites/6/2018/06/asun_0_0.png",
      "width": 220,
      "height": 151,
      "caption": "asun_0"
    },
    "twitter": {
      "twitter:label1": "Escrito por",
      "twitter:data1": "ajimenez",
      "twitter:label2": "Tiempo de lectura",
      "twitter:data2": "1 minuto"
    }
  },
  "blocks": [
    {
      "type": "html",
      "html": "<p class=\"rtejustify\">La Catedrática de Universidad y profesoresa del MUIA, Asunción Gómez Pérez ha sido recientemente nombrada&nbsp;Fellow of the European Academy of Sciences.&nbsp;La asociación integra a los investigadores y académicos más relevantes en distintas disciplinas científicas, entre ellas la ingeniería, y promueve el empleo de las nuevas tecnologías para contribuir al desarrollo humano y económico.</p>\n<p><span id=\"more-125\"></span></p>\n<p class=\"rtejustify\">La Catedrática de Universidad y profesoresa del MUIA, Asunción Gómez Pérez ha sido recientemente nombrada&nbsp;<a href=\"http://www.eurasc.org/new_mem.asp#531\" target=\"_blank\" rel=\"noopener\">Fellow of the European Academy of Sciences</a>.&nbsp;La asociación integra a los investigadores y académicos más relevantes en distintas disciplinas científicas, entre ellas la ingeniería, y promueve el empleo de las nuevas tecnologías para contribuir al desarrollo humano y económico.</p>\n<p style=\"text-align:center\"><img fetchpriority=\"high\" decoding=\"async\" class=\" size-full wp-image-124\" alt=\"\" height=\"345\" src=\"/wp-content/uploads/sites/6/2018/06/Asun-Fellow.png\" width=\"600\" srcset=\"/wp-content/uploads/sites/6/2018/06/Asun-Fellow.png 1200w, /wp-content/uploads/sites/6/2018/06/Asun-Fellow-300x173.png 300w, /wp-content/uploads/sites/6/2018/06/Asun-Fellow-1024x589.png 1024w, /wp-content/uploads/sites/6/2018/06/Asun-Fellow-768x442.png 768w\" sizes=\"(max-width: 600px) 100vw, 600px\"></p>"
    }
  ],
  "featuredImage": {
    "src": "/wp-content/uploads/sites/6/2018/06/asun_0_0.png",
    "width": 220,
    "height": 151,
    "alt": "asun_0"
  },
  "wordCount": 150,
  "excerpt": "<p>La Catedrática de Universidad y profesoresa del MUIA, Asunción Gómez Pérez ha sido recientemente nombrada&nbsp;Fellow of the European Academy of</p>",
  "listImage": {
    "src": "/wp-content/uploads/sites/6/2018/06/asun_0_0.png",
    "width": 220,
    "height": 151,
    "alt": "asun_0"
  }
}
