{
  "slug": "la-catedratica-de-la-upm-asuncion-gomez-perez-miembro-del-consejo-asesor-de-inteligencia-artificial",
  "lang": "es",
  "path": "/es/la-catedratica-de-la-upm-asuncion-gomez-perez-miembro-del-consejo-asesor-de-inteligencia-artificial/",
  "title": "La catedrática de la UPM Asunción Gómez-Pérez, miembro del Consejo Asesor de Inteligencia Artificial",
  "wpId": 244,
  "date": "2020-07-21T10:15:51+00:00",
  "modified": "2023-11-23T18:26:26+00:00",
  "author": "admin",
  "categories": [
    "noticias-es"
  ],
  "tags": [],
  "translations": {},
  "seo": {
    "title": "La catedrática de la UPM Asunción Gómez-Pérez, miembro del Consejo Asesor de Inteligencia Artificial - Máster Universitario en Inteligencia Artificial",
    "ogDescription": "El Gobierno ha constituido el Consejo Asesor de Inteligencia Artificial, compuesto por expertos españoles de reconocido prestigio internacional, entre los […]",
    "image": {
      "src": "/wp-content/uploads/sites/6/2020/07/asuninterior.jpg",
      "width": 220,
      "height": 165,
      "type": "image/jpeg"
    },
    "schemaImage": {
      "src": "/wp-content/uploads/sites/6/2020/07/asuninterior.jpg",
      "width": 220,
      "height": 165,
      "caption": "asuninterior"
    },
    "twitter": {
      "twitter:label1": "Escrito por",
      "twitter:data1": "admin",
      "twitter:label2": "Tiempo de lectura",
      "twitter:data2": "6 minutos"
    }
  },
  "blocks": [
    {
      "type": "html",
      "html": "<p class=\"rtejustify\"><span style=\"font-size:12px\">El Gobierno ha constituido el Consejo Asesor de Inteligencia Artificial, compuesto por expertos españoles de reconocido prestigio internacional, entre los que hay representantes del ámbito científico, económico y educativo. Asunción Gómez-Pérez, catedrática de Inteligencia Artificial de la UPM, forma parte de este Consejo.</span></p>\n<p class=\"rtejustify\"><span style=\"font-size:12px\">21.07.2020</span></p>\n<p><span style=\"font-size:14px\">El Gobierno ha presentado el Consejo Asesor de Inteligencia Artificial, un órgano consultivo que proporcionará asesoramiento y recomendaciones independientes sobre las medidas a adoptar para garantizar un uso seguro y ético de la Inteligencia Artificial.</span></p>\n<p>El órgano está compuesto por expertos españoles de máximo prestigio a nivel internacional en la materia, que contribuirán a la finalización y puesta en marcha de la Estrategia Nacional de Inteligencia Artificial. Entre ellos figura Asunción Gómez-Pérez, catedrática del Departamento de Inteligencia Artificial y vicerrectora de Investigación, Innovación y Doctorado de la Universidad Politécnica de Madrid (UPM).</p>\n<p>Los miembros del Consejo Asesor analizarán las implicaciones que estas tecnologías disruptivas supondrán en ámbitos diversos, tales como el de la empresa, la administración y el futuro del trabajo, la protección de los derechos fundamentales, la gestión del dato, la lucha contra la discriminación o la eliminación de brechas sociales.</p>\n<p><strong>Una de las mujeres más influyentes del mundo en Web semántica</strong></p>\n<p>Doctora en Informática por la&nbsp;<a href=\"https://www.fi.upm.es/\">Facultad de Informática</a>&nbsp;de la&nbsp;<a href=\"https://www.upm.es/\">Universidad Politécnica de Madrid</a>&nbsp;(UPM) y Máster en Administración y Dirección de Empresas (MBA) por la Universidad Pontificia de Comillas ICADE, Asunción Gómez-Pérez es la directora académica del Máster Universitario en Inteligencia Artificial y del Doctorado en Inteligencia Artificial en la UPM (desde 2009), además de&nbsp;<em>Fellow de la European Academy of Sciences</em>&nbsp;(EurAsc).</p>\n<p>Con más de 20 años de experiencia internacional en las áreas de ingeniería ontológica, web semántica, datos enlazados, el multilingüismo en datos y la gestión de conocimientos, lidera el&nbsp;<em>Ontology Engineering Group</em>&nbsp;desde 1995, grupo de investigación de referencia internacional en estas materias. La profesora Gómez-Pérez ha publicado numerosos trabajos de investigación que han tenido un extraordinario impacto, y es considerada como una de las mujeres más influyentes en el mundo en Web semántica.</p>\n<p>Una faceta muy importante en su trayectoria profesional es su participación en proyectos de investigación. Ha coordinado 5 proyectos europeos, y ha participado como investigadora principal en 24 proyectos internacionales, la mayoría del quinto, sexto y séptimo Programa Marco. Ahora participa en tres proyectos del Programa H2020. Además, ha participado en 45 proyectos de investigación del Plan Nacional de investigación fundamental, redes, acciones especiales, y de transferencia tecnológica (CENIT, Cien, Avanza, Profit…) y ha dirigido más de 35 proyectos financiados de empresas nacionales e internacionales. Cuenta con más de 300 publicaciones de impacto elevado, y ha dirigido 22 tesis doctorales (7 con premio extraordinario y 11 con mención europea).</p>\n<p>Entre los últimos hitos conseguidos, destaca que la profesora Gómez-Pérez es la investigadora principal del primer proyecto que utiliza IBM-Watson en una Universidad española. Este proyecto está financiado por IBM USA y fue obtenido en una convocatoria del&nbsp;<em>Shared University Research (SUR) Awards</em>. Por otro lado, el&nbsp;<em>Open Data Institute</em>&nbsp;del Reino Unido, fundado por Tim Berners Lee, ha seleccionado al&nbsp;<em>Ontology Engineering Group&nbsp;</em>como sede del nodo en Madrid y a Asunción Gómez Pérez como responsable del mismo.</p>\n<p>La profesora de la UPM ha sido galardonada con el Premio Nacional Ada Byron a la Mujer Tecnóloga (2015) y el Premio ARITMEL, concedido en el área de los Premios Nacionales de Informática 2015.</p>\n<p><strong>Composición del Consejo Asesor de Inteligencia Artificial</strong></p>\n<p>La vicepresidenta tercera y ministra de Asuntos Económicos y Transformación Digital, Nadia Calviño, presidirá el Consejo Asesor, y la secretaria de Estado de Digitalización e Inteligencia Artificial, Carme Artigas, ocupará la vicepresidencia.</p>\n<p>El Consejo Asesor está integrado por expertos españoles de diversos ámbitos sociales, económicos y científicos. Junto a la catedrática de la UPM, lo integran Amparo Alonso, catedrática de Ciencias de la Computación e Inteligencia Artificial de la Universidad de La Coruña; Juan Luis Arsuaga, doctor en Ciencias Biológicas y catedrático de Paleontología, siendo desde julio de 2013 director científico del Museo de la Evolución Humana de Burgos; Ricardo Baeza-Yates, catedrático de la Institución Catalana de Investigación y Estudios Avanzados (ICREA) y fundador del Grupo de Ciencias de la Web y Computación Social de la Universitat Pompeu Fabra; Manuel Cebrián, que lidera el grupo de investigación de Movilización Digital del Instituto Max Planck; Emilia Gómez, investigadora del Centro Común de Investigación de la Comisión Europea, donde participa como científica principal en el proyecto sobre Comportamiento Humano e Inteligencia Artificial en la Transformación Digital; Francisco Herrera, director del Instituto Andaluz Interuniversitario en Ciencia de Datos e Inteligencia Artificial; Lorena Jaume Palasí, directora ejecutiva de AlgorithmWatch, donde centra su trabajo en la filosofía del Derecho y la ética de la automatización y de la digitalización; José Ignacio Latorre, catedrático de Física teórica de la Universidad de Barcelona y director del Centro de Ciencias de Benasque Pedro Pascual; Pilar Manchón, doctora en Lingüística Computacional por la Universidad de Sevilla.</p>\n<p><img fetchpriority=\"high\" decoding=\"async\" class=\" size-full wp-image-243\" alt=\"\" src=\"/wp-content/uploads/sites/6/2020/07/consejoasesor.jpg\" width=\"512\" height=\"340\" srcset=\"/wp-content/uploads/sites/6/2020/07/consejoasesor.jpg 512w, /wp-content/uploads/sites/6/2020/07/consejoasesor-300x199.jpg 300w\" sizes=\"(max-width: 512px) 100vw, 512px\"></p>\n<p>También Inmaculada Martínez, pionera tecnológica involucrada en los sectores de innovación y digitalización desde hace más de dos décadas; Alexandre Pérez Casares, presidente y cofundador de The Altius Society; Joaquín Quiñonero, doctor por la Universidad Técnica de Dinamarca, ha trabajado como investigador en el Instituto Max Planck de Cibernética Biológica, siendo experto en investigación aplicada en visión por computador, reconocimiento de voz, comprensión del lenguaje, personalización y recomendaciones; Luz Rello, investigadora del Departamento de Tecnologías de la Información y las Comunicaciones de la Universidad Pompeu Fabra; Pablo Rodríguez, investigador en desarrollos tecnológicos a largo plazo sobre tecnologías disruptivas; Antonio Torralba, profesor de Ingeniería Eléctrica y de Ciencias de la Computación en el Instituto Tecnológico de Massachusetts y jefe de la Facultad de Inteligencia Artificial y Toma de Decisiones; Carmen Torras, profesora de investigación en el Instituto de Robótica perteneciente al Consejo Superior de Investigaciones Científicas; y Rafael Yuste, neurobiólogo impulsor del proyecto BRAIN de Investigación del Cerebro a través del Avance de Neurotecnologías Innovadoras.</p>\n<p>Fuente:&nbsp;<a href=\"https://www.upm.es/UPM?id=1abf3b4909073710VgnVCM10000009c7648a____&amp;prefmt=articulo&amp;fmt=detail\">https://www.upm.es/UPM?id=1abf3b4909073710VgnVCM10000009c7648a____&amp;prefmt=articulo&amp;fmt=detail</a></p>"
    }
  ],
  "featuredImage": {
    "src": "/wp-content/uploads/sites/6/2020/07/asuninterior.jpg",
    "width": 220,
    "height": 165,
    "alt": "asuninterior"
  },
  "wordCount": 1153,
  "excerpt": "<p>El Gobierno ha constituido el Consejo Asesor de Inteligencia Artificial, compuesto por expertos españoles de reconocido prestigio internacional, entre los</p>",
  "listImage": {
    "src": "/wp-content/uploads/sites/6/2020/07/asuninterior.jpg",
    "width": 220,
    "height": 165,
    "alt": "asuninterior"
  }
}
